{"header":{"adapterId":"aaaaaaaaaaaaaaaaaaaaaaaaaaaaaaaaaaaaaaaaaaaaaaaaaaaaaaaaaaaaaaaa","cacheConfigId":"eeeeeeeeeeeeeeeeeeeeeeeeeeeeeeeeeeeeeeeeeeeeeeeeeeeeeeeeeeeeeeee","headRepository":"acme/example","kind":"bootstrap","ledgerEpoch":"BBBBBBBBBBBBBBBBBBBBBB","modelId":"model-2026-01","policyId":"cccccccccccccccccccccccccccccccccccccccccccccccccccccccccccccccc","predecessorLedgerSha256":"bootstrap","providerId":"provider.reference","pullRequest":123,"repository":"acme/example","sessionEpoch":"AAAAAAAAAAAAAAAAAAAAAA","stateGeneration":0,"templateId":"bbbbbbbbbbbbbbbbbbbbbbbbbbbbbbbbbbbbbbbbbbbbbbbbbbbbbbbbbbbbbbbb","toolDefinitionId":"dddddddddddddddddddddddddddddddddddddddddddddddddddddddddddddddd","trustedExecutionDomain":"github-actions","workflowIdentity":"acme/example/.github/workflows/ci.yml"},"prefixContractVersion":1,"records":[{"cacheContractDigest":"ab6c7661e5e2cc70a639d974c038db914a24bd28684db91900bbd415a4ef3de9","changedFiles":[{"additions":1,"changes":1,"deletions":0,"patch":{"maxChars":4000,"sha256":"9999999999999999999999999999999999999999999999999999999999999999","truncated":false},"path":"src/main.cs","status":"modified"}],"interactionId":"0000000000000000000000000000000000000000000000000000000000000000","interactionOrdinal":0,"reviewedBaseSha":"2222222222222222222222222222222222222222","reviewedHeadSha":"1111111111111111111111111111111111111111","role":"review_context","subjectDigest":"6f0fc49580da6eb9d239d366ad126db3eb53155dce5ee2eeef7234d61bb9c1ed"},{"findings":[],"interactionId":"0000000000000000000000000000000000000000000000000000000000000000","interactionOrdinal":0,"limitations":["No live provider was invoked."],"role":"review_outcome","summary":"a\u0000b"}],"schemaVersion":1}