{"header":{"adapterId":"adapter","cacheConfigId":"cacheconfig","headRepository":"owner/repo","kind":"bootstrap","ledgerEpoch":"bbbbbbbbbbbbbbbbbbbbbb","modelId":"latest","policyId":"policy","predecessorLedgerSha256":"bootstrap","providerId":"provider","pullRequest":1,"repository":"owner/repo","sessionEpoch":"aaaaaaaaaaaaaaaaaaaaaa","stateGeneration":0,"templateId":"template","toolDefinitionId":"tools","trustedExecutionDomain":"trusted","workflowIdentity":"ci"},"prefixContractVersion":1,"records":[{"interactionId":"0000000000000000000000000000000000000000000000000000000000000000","interactionOrdinal":0,"role":"review_context","cacheContractDigest":"ed4da62537881c0b787345f55f078e29c2068fead8a170d183d5cdc78ad8631c","changedFiles":[],"reviewedBaseSha":"1111111111111111111111111111111111111111","reviewedHeadSha":"0000000000000000000000000000000000000000","subjectDigest":"1111111111111111111111111111111111111111111111111111111111111111"},{"interactionId":"0000000000000000000000000000000000000000000000000000000000000000","interactionOrdinal":0,"role":"review_outcome","findings":[],"limitations":[],"summary":"Summary text."}],"schemaVersion":1}