{"header":{"adapterId":"ae1eae1d76e5b7c865c4122ce366a08025842566d2d96c75cc13e6353a73db0d","cacheConfigId":"3786c8b5fa08b53ee6c91f9a14b4324ea9018b37e738638ee7bf778ea85ec8d6","headRepository":"owner/repo","kind":"bootstrap","ledgerEpoch":"bbbbbbbbbbbbbbbbbbbbbb","modelId":"model-2024-01-01","policyId":"823412d1eacb67956220e532959f0104603057c88704863ca38e7cd188fda812","predecessorLedgerSha256":"bootstrap","providerId":"provider","pullRequest":1,"repository":"owner/repo","sessionEpoch":"aaaaaaaaaaaaaaaaaaaaaa","stateGeneration":0,"templateId":"5cde0f1298f41f7d1c8b907a36992a7a513225a2615bd6e307bf1a9149b06b40","toolDefinitionId":"f9d35d43770d39092a663e665e82ae1d84a9e0da3d0d10c407acada6a40cd281","trustedExecutionDomain":"trusted","workflowIdentity":"ci"},"prefixContractVersion":1,"records":[{"cacheContractDigest":"bb4b2c18e601bdf52bf25b087488b19c8fe49c16cf5ec5e9f9ce0018d7bc72c8","changedFiles":[],"interactionId":"0000000000000000000000000000000000000000000000000000000000000000","interactionOrdinal":0,"reviewedBaseSha":"1111111111111111111111111111111111111111","reviewedHeadSha":"0000000000000000000000000000000000000000","role":"review_context","subjectDigest":"1111111111111111111111111111111111111111111111111111111111111111"},{"findings":[],"interactionId":"0000000000000000000000000000000000000000000000000000000000000000","interactionOrdinal":0,"limitations":[],"role":"review_outcome","summary":"   "}],"schemaVersion":1}