{"header":{"adapterId":"aaaaaaaaaaaaaaaaaaaaaaaaaaaaaaaaaaaaaaaaaaaaaaaaaaaaaaaaaaaaaaaa","cacheConfigId":"eeeeeeeeeeeeeeeeeeeeeeeeeeeeeeeeeeeeeeeeeeeeeeeeeeeeeeeeeeeeeeee","headRepository":"acme/example","kind":"reset","ledgerEpoch":"DDDDDDDDDDDDDDDDDDDDDD","modelId":"model-2026-01","policyId":"cccccccccccccccccccccccccccccccccccccccccccccccccccccccccccccccc","predecessorLedgerEpoch":"BBBBBBBBBBBBBBBBBBBBBB","predecessorLedgerSha256":"5b217e2c4c245b8e40ef82c6d5ed7a14c65580b4300a8dd421840b547a283eb3","predecessorManifestSha256":"8888888888888888888888888888888888888888888888888888888888888888","predecessorStateGeneration":0,"providerId":"provider.reference","pullRequest":123,"repository":"acme/example","resetReason":"base_change","sessionEpoch":"AAAAAAAAAAAAAAAAAAAAAA","stateGeneration":1,"templateId":"bbbbbbbbbbbbbbbbbbbbbbbbbbbbbbbbbbbbbbbbbbbbbbbbbbbbbbbbbbbbbbbb","toolDefinitionId":"dddddddddddddddddddddddddddddddddddddddddddddddddddddddddddddddd","trustedExecutionDomain":"github-actions","workflowIdentity":"acme/example/.github/workflows/ci.yml"},"prefixContractVersion":1,"records":[{"cacheContractDigest":"780583a8ceff035d296267b621c5b6a08fce1af98305c4c4be885784fea39bd0","changedFiles":[{"additions":1,"changes":1,"deletions":0,"patch":{"maxChars":4000,"sha256":"9999999999999999999999999999999999999999999999999999999999999999","truncated":false},"path":"src/main.cs","status":"modified"}],"interactionId":"0000000000000000000000000000000000000000000000000000000000000000","interactionOrdinal":0,"reviewedBaseSha":"6666666666666666666666666666666666666666","reviewedHeadSha":"5555555555555555555555555555555555555555","role":"review_context","subjectDigest":"6f0fc49580da6eb9d239d366ad126db3eb53155dce5ee2eeef7234d61bb9c1ed"},{"findings":[],"interactionId":"0000000000000000000000000000000000000000000000000000000000000000","interactionOrdinal":0,"limitations":["No live provider was invoked."],"role":"review_outcome","summary":"Reset after base change."}],"schemaVersion":1}