{"header":{"adapterId":"aaaaaaaaaaaaaaaaaaaaaaaaaaaaaaaaaaaaaaaaaaaaaaaaaaaaaaaaaaaaaaaa","cacheConfigId":"eeeeeeeeeeeeeeeeeeeeeeeeeeeeeeeeeeeeeeeeeeeeeeeeeeeeeeeeeeeeeeee","headRepository":"acme/example","kind":"continuation","ledgerEpoch":"BBBBBBBBBBBBBBBBBBBBBB","modelId":"model-2026-01","policyId":"cccccccccccccccccccccccccccccccccccccccccccccccccccccccccccccccc","predecessorLedgerEpoch":"GGGGGGGGGGGGGGGGGGGGGG","predecessorLedgerSha256":"5b217e2c4c245b8e40ef82c6d5ed7a14c65580b4300a8dd421840b547a283eb3","predecessorStateGeneration":0,"providerId":"provider.reference","pullRequest":123,"repository":"acme/example","sessionEpoch":"AAAAAAAAAAAAAAAAAAAAAA","stateGeneration":1,"templateId":"bbbbbbbbbbbbbbbbbbbbbbbbbbbbbbbbbbbbbbbbbbbbbbbbbbbbbbbbbbbbbbbb","toolDefinitionId":"dddddddddddddddddddddddddddddddddddddddddddddddddddddddddddddddd","trustedExecutionDomain":"github-actions","workflowIdentity":"acme/example/.github/workflows/ci.yml"},"prefixContractVersion":1,"records":[{"cacheContractDigest":"780583a8ceff035d296267b621c5b6a08fce1af98305c4c4be885784fea39bd0","changedFiles":[{"additions":1,"changes":1,"deletions":0,"patch":{"maxChars":4000,"sha256":"9999999999999999999999999999999999999999999999999999999999999999","truncated":false},"path":"src/main.cs","status":"modified"}],"interactionId":"0000000000000000000000000000000000000000000000000000000000000000","interactionOrdinal":0,"reviewedBaseSha":"2222222222222222222222222222222222222222","reviewedHeadSha":"1111111111111111111111111111111111111111","role":"review_context","subjectDigest":"6f0fc49580da6eb9d239d366ad126db3eb53155dce5ee2eeef7234d61bb9c1ed"},{"findings":[],"interactionId":"0000000000000000000000000000000000000000000000000000000000000000","interactionOrdinal":0,"limitations":["No live provider was invoked."],"role":"review_outcome","summary":"Bootstrap review complete."},{"cacheContractDigest":"780583a8ceff035d296267b621c5b6a08fce1af98305c4c4be885784fea39bd0","changedFiles":[{"additions":1,"changes":1,"deletions":0,"patch":{"maxChars":4000,"sha256":"9999999999999999999999999999999999999999999999999999999999999999","truncated":false},"path":"src/main.cs","status":"modified"}],"interactionId":"0000000100000000000000000000000000000000000000000000000000000000","interactionOrdinal":1,"reviewedBaseSha":"2222222222222222222222222222222222222222","reviewedHeadSha":"3333333333333333333333333333333333333333","role":"review_context","subjectDigest":"4afa4179276b808c2c652b6479ee8e61fcc0bd61a6d1f2d67e50d381ebe3a518"},{"findings":[],"interactionId":"0000000100000000000000000000000000000000000000000000000000000000","interactionOrdinal":1,"limitations":["No live provider was invoked."],"role":"review_outcome","summary":"Continuation review complete."}],"schemaVersion":1}