{"header":{"adapterId":"aaaaaaaaaaaaaaaaaaaaaaaaaaaaaaaaaaaaaaaaaaaaaaaaaaaaaaaaaaaaaaaa","cacheConfigId":"eeeeeeeeeeeeeeeeeeeeeeeeeeeeeeeeeeeeeeeeeeeeeeeeeeeeeeeeeeeeeeee","headRepository":"acme/example","kind":"bootstrap","ledgerEpoch":"BBBBBBBBBBBBBBBBBBBBBB","modelId":"model-2026-01","policyId":"cccccccccccccccccccccccccccccccccccccccccccccccccccccccccccccccc","predecessorLedgerSha256":"bootstrap","providerId":"provider.reference","pullRequest":123,"repository":"acme/example","sessionEpoch":"AAAAAAAAAAAAAAAAAAAAAA","stateGeneration":0,"templateId":"bbbbbbbbbbbbbbbbbbbbbbbbbbbbbbbbbbbbbbbbbbbbbbbbbbbbbbbbbbbbbbbb","toolDefinitionId":"dddddddddddddddddddddddddddddddddddddddddddddddddddddddddddddddd","trustedExecutionDomain":"github-actions","workflowIdentity":"acme/example/.github/workflows/ci.yml"},"prefixContractVersion":1,"records":[],"schemaVersion":1}